{
  "schema_version": "0.4.0",
  "id": "66666666-6666-4666-8666-666666666666",
  "project_id": "11111111-1111-4111-8111-111111111111",
  "created_at": "2026-08-18T02:30:00Z",
  "created_by": "主编",
  "subject": "残玉",
  "predicate": "可开启",
  "object": "祠门",
  "value": "可开祠门",
  "effective_story_time": "第一日黄昏",
  "source_scene_id": "33333333-3333-4333-8333-333333333333",
  "evidence_quote": "她把残玉按进缺口，门轴轻响",
  "confidence": 0.86,
  "status": "AwaitingVerdict"
}
